<?xml version="1.0" encoding="UTF-8"?>
<mensajes xmlns:xsi="http://www.w3.org/2001/XMLSchema-instance" xsi:noNamespaceSchemaLocation="file:///E:/entornos/git/XML-Esquemas/ejercicio%201_1/8_esquema.xsd">
  <mensaje>
    <de>Pepe (pepe@example.com)</de>
    <para>Juan (juan@example.com)</para>
    <!--<hora>28/02/2011 17:48:23</hora> -->
    <hora>2011-02-28T17:48:23</hora>
    <texto>¿Hola, Juan, qué haces?</texto>
  </mensaje>
  <mensaje>
    <de>Juan (juan@example.com)</de>
    <para>Pepe (pepe@example.com)</para>
    <hora>2011-02-28T17:54:20.58</hora>
    <!-- <hora>2011-02-28T17:54:20</hora> -->
    <texto>Aquí, aprendiendo <strong>XML</strong></texto>
  </mensaje>
</mensajes>
